{
  "facts_version": "0.2",
  "service": "insight",
  "source_commit": "0000000",
  "extracted_at": "2026-09-28T12:00:00Z",
  "nodes": [
    {"id": "svc.insight", "type": "service", "name": "insight", "path": "Unite/services/insight",
     "packages": ["asset", "insight-core"],
     "summary": "Generates insights for assets; reacts to asset-created and resource-failed events."},
    {"id": "evt.asset.asset-created", "type": "event", "name": "AssetCreated",
     "source": "service.asset", "detail_type": "AssetCreated"},
    {"id": "evt.resource.resource-failed", "type": "event", "name": "resource.failed",
     "source": "service.resource", "detail_type": "resource.failed"},
    {"id": "q.insight-generation", "type": "queue", "name": "insight-generation",
     "physical_name": "insight-${self:custom.T.STAGE}-generation", "fifo": false, "owner_service": "insight"},
    {"id": "tbl.dynamodb.insight-entities", "type": "table", "name": "insight-entities", "db": "dynamodb",
     "physical_name": "insight-${self:custom.T.STAGE}-Entities", "defined_in": "Unite/services/t.yml:1742",
     "keys": ["PK", "SK"]},
    {"id": "fld.dynamodb.insight-entities.entity-id", "type": "field", "name": "entityId",
     "owner": "tbl.dynamodb.insight-entities", "data_type": "string", "pii": false, "pii_category": "none",
     "pii_confidence": 1.0},
    {"id": "test.insight.insight-core-eventbridge-asset-created-spec", "type": "test", "name": "asset-created.spec.ts",
     "file": "Unite/packages/insight-core/src/eventbridge/asset-created.spec.ts", "framework": "jest"}
  ],
  "edges": [
    {"from": "svc.insight", "type": "CONSUMES", "to": "evt.asset.asset-created",
     "evidence": "Unite/services/insight/serverless.yml:213", "snippet": "- service.asset.${self:custom.T.STAGE}",
     "confidence": 1.0, "via": "serverless.yml", "filter": {"record.sourceType": ["RESOURCE_MANAGER"]}},
    {"from": "svc.insight", "type": "CONSUMES", "to": "evt.resource.resource-failed",
     "evidence": "Unite/services/insight/serverless.yml:229", "snippet": "- service.resource.${self:custom.T.STAGE}",
     "confidence": 1.0, "via": "serverless.yml", "filter": {"resourceCallbackSource": ["update_resource"]}},
    {"from": "svc.insight", "type": "PUBLISHES", "to": "q.insight-generation",
     "evidence": "Unite/packages/insight-core/src/queue/send-generation.ts:18", "snippet": "SendMessageCommand",
     "confidence": 0.8, "via": "package:insight-core"},
    {"from": "svc.insight", "type": "CONSUMES", "to": "q.insight-generation",
     "evidence": "Unite/services/insight/serverless.yml:244", "snippet": "- sqs:",
     "confidence": 1.0, "via": "serverless.yml"},
    {"from": "svc.insight", "type": "READS", "to": "tbl.dynamodb.insight-entities",
     "evidence": "Unite/packages/insight-core/src/eventbridge/asset-created.ts:120", "snippet": "GetCommand",
     "confidence": 0.8, "via": "package:insight-core"},
    {"from": "svc.insight", "type": "WRITES", "to": "tbl.dynamodb.insight-entities",
     "evidence": "Unite/packages/insight-core/src/repository.ts:44", "snippet": "PutCommand",
     "confidence": 0.8, "via": "package:insight-core"},
    {"from": "tbl.dynamodb.insight-entities", "type": "HAS_FIELD", "to": "fld.dynamodb.insight-entities.entity-id",
     "evidence": "Unite/packages/insight-core/src/repository.ts:12", "snippet": "entityId",
     "confidence": 0.8, "via": "package:insight-core"},
    {"from": "test.insight.insight-core-eventbridge-asset-created-spec", "type": "TESTS", "to": "svc.insight",
     "evidence": "Unite/packages/insight-core/src/eventbridge/asset-created.spec.ts:1",
     "snippet": "processAssetCreatedEvent", "confidence": 0.8, "via": "package:insight-core"}
  ]
}
